Series;Product Image;Description;Contact form;Image path;Datasheet part;3d model part
Aluminum Electrolytic Capacitors;Enlarge;Custom Capabilities Aluminum Electrolytic Capacitors;aluminumcaps@vishay.com;28419;capacitors\Aluminum Electrolytic Capacitors\Aluminum Electrolytic Capacitors.pdf;
Ceramic Power Capacitors;Enlarge;Custom Capabilities RF Power Plate Capacitors;powcap@vishay.com;22178;capacitors\Ceramic Power Capacitors\Ceramic Power Capacitors.pdf;
Ceramic Power Capacitors;Enlarge;Custom Capabilities RF Power Barrel Capacitors;powcap@vishay.com;23146;capacitors\Ceramic Power Capacitors\Ceramic Power Capacitors.pdf;
Power Capacitors;Enlarge;Custom Capabilities ESTA Power Capacitors;esta@vishay.com;13199;capacitors\Power Capacitors\Power Capacitors.pdf;
Wet Tantalum Assemblies and Arrays;Enlarge;Custom Capabilities Wet Tantalum Assemblies and Arrays;tantalum@vishay.com;40210;capacitors\Wet Tantalum Assemblies and Arrays\Wet Tantalum Assemblies and Arrays.pdf;
